{
  "current_question_id": 25,
  "completed_questions": [
    25,
    48,
    50,
    58,
    61,
    62,
    63,
    72,
    68,
    120
  ],
  "correct_questions": [
    25,
    48,
    50,
    68,
    72
  ],
  "wrong_questions": [
    25,
    58,
    61,
    62,
    120
  ],
  "flagged_questions": [],
  "weak_patterns": {
    "Blue/Green con CodeDeploy vs Elastic Beanstalk": 2
  },
  "confidence_history": [
    {
      "question_id": 25,
      "confidence": 3,
      "recorded_at": "2026-03-23T00:20:00-06:00"
    },
    {
      "question_id": 48,
      "confidence": 2,
      "recorded_at": "2026-03-23T00:35:00-06:00"
    },
    {
      "question_id": 50,
      "confidence": 3,
      "recorded_at": "2026-03-23T00:45:00-06:00"
    },
    {
      "question_id": 120,
      "confidence": 5,
      "recorded_at": "2026-03-23T00:55:00-06:00"
    },
    {
      "question_id": 58,
      "confidence": 2,
      "recorded_at": "2026-03-23T01:15:00-06:00"
    },
    {
      "question_id": 61,
      "confidence": 2,
      "recorded_at": "2026-03-23T01:25:00-06:00"
    },
    {
      "question_id": 62,
      "confidence": 3,
      "recorded_at": "2026-03-23T01:35:00-06:00"
    },
    {
      "question_id": 63,
      "confidence": 2,
      "recorded_at": "2026-03-23T01:45:00-06:00"
    },
    {
      "question_id": 68,
      "confidence": 2,
      "recorded_at": "2026-03-23T02:00:00-06:00"
    },
    {
      "question_id": 72,
      "confidence": 3,
      "recorded_at": "2026-03-23T02:10:00-06:00"
    }
  ],
  "response_time_history": [],
  "mistake_clusters": {
    "deployment_strategy_selection": 1,
    "branching_and_pipeline_design": 1,
    "codedeploy_alarm_integration": 1,
    "beanstalk_worker_architecture": 1,
    "beanstalk_blue_green_delivery": 1,
    "codepipeline_event_granularity": 1
  },
  "trap_patterns": {
    "mezclar servicio correcto con estrategia correcta": 1,
    "aprobar master no equivale a desplegar production branch": 1,
    "CodeDeploy usa alarmas, no metricas directas": 1,
    "detectar patron correcto pero elegir la variante casi igual incorrecta": 1,
    "Beanstalk Blue/Green no funciona como CodeDeploy Blue/Green": 1,
    "pipeline failure no es igual a stage failure": 1
  },
  "mastery_by_system": {
    "1_ci_cd": {
      "answered": 12,
      "correct": 6,
      "partial": 1,
      "wrong": 5,
      "mastery_score": 0.21
    }
  },
  "mastery_by_topic": {
    "CodeDeploy": {
      "answered": 3,
      "correct": 2,
      "partial": 0,
      "wrong": 1,
      "mastery_score": 0.1
    },
    "ALB health check": {
      "answered": 1,
      "correct": 1,
      "partial": 0,
      "wrong": 0,
      "mastery_score": 0.08
    },
    "CodePipeline branching": {
      "answered": 1,
      "correct": 0,
      "partial": 0,
      "wrong": 1,
      "mastery_score": 0
    },
    "CodeDeploy alarms": {
      "answered": 1,
      "correct": 0,
      "partial": 0,
      "wrong": 1,
      "mastery_score": 0
    },
    "Elastic Beanstalk worker": {
      "answered": 1,
      "correct": 0,
      "partial": 0,
      "wrong": 1,
      "mastery_score": 0
    },
    "Elastic Beanstalk BlueGreen": {
      "answered": 1,
      "correct": 0,
      "partial": 0,
      "wrong": 1,
      "mastery_score": 0
    },
    "CodePipeline events": {
      "answered": 1,
      "correct": 0,
      "partial": 1,
      "wrong": 0,
      "mastery_score": 0.03
    },
    "CodeCommit PR automation": {
      "answered": 1,
      "correct": 1,
      "partial": 0,
      "wrong": 0,
      "mastery_score": 0.08
    },
    "CodeDeploy canary modeling": {
      "answered": 1,
      "correct": 1,
      "partial": 0,
      "wrong": 0,
      "mastery_score": 0.08
    }
  },
  "question_review_schedule": {
    "25": {
      "priority": 2,
      "review_bucket": "soon",
      "reason": "Respondida correctamente, pero con confianza moderada despues de una confusion previa entre CodeDeploy Blue/Green y Elastic Beanstalk.",
      "last_reviewed_at": "2026-03-23T00:20:00-06:00"
    },
    "48": {
      "priority": 2,
      "review_bucket": "soon",
      "reason": "Respondida correctamente, pero con baja confianza y lagunas en conceptos base de CI/CD y contenedores.",
      "last_reviewed_at": "2026-03-23T00:35:00-06:00"
    },
    "50": {
      "priority": 2,
      "review_bucket": "soon",
      "reason": "Respondida correctamente con confianza moderada. Conviene reforzar la diferencia entre health checks y smoke tests.",
      "last_reviewed_at": "2026-03-23T00:45:00-06:00"
    },
    "58": {
      "priority": 1,
      "review_bucket": "urgent",
      "reason": "Confusion entre metrica y alarma de CloudWatch para rollback automatico en CodeDeploy, y entre CPU de EC2 vs ALB.",
      "last_reviewed_at": "2026-03-23T01:15:00-06:00"
    },
    "61": {
      "priority": 1,
      "review_bucket": "urgent",
      "reason": "Se detecto el patron correcto de worker tier + SQS, pero se eligio la variante incorrecta por detalle de implementacion de Beanstalk.",
      "last_reviewed_at": "2026-03-23T01:25:00-06:00"
    },
    "62": {
      "priority": 1,
      "review_bucket": "urgent",
      "reason": "Confusion entre el Blue/Green de Beanstalk y el de CodeDeploy. En Beanstalk se requieren dos entornos y CNAME swap.",
      "last_reviewed_at": "2026-03-23T01:35:00-06:00"
    },
    "63": {
      "priority": 2,
      "review_bucket": "soon",
      "reason": "Acierto parcial. Se detecto el patron event-driven, pero se confundio pipeline failure con stage failure.",
      "last_reviewed_at": "2026-03-23T01:45:00-06:00"
    },
    "68": {
      "priority": 2,
      "review_bucket": "soon",
      "reason": "Respondida correctamente con baja confianza. Conviene consolidar el patron event-driven para Pull Requests y resultado de CodeBuild.",
      "last_reviewed_at": "2026-03-23T02:00:00-06:00"
    },
    "72": {
      "priority": 3,
      "review_bucket": "normal",
      "reason": "Respondida correctamente. Se entendio bien el patron de canary modelado con deployment groups separados y aprobacion manual.",
      "last_reviewed_at": "2026-03-23T02:10:00-06:00"
    },
    "120": {
      "priority": 1,
      "review_bucket": "urgent",
      "reason": "Se eligio aprobacion manual en un solo pipeline, pero el requisito exige desplegar production solo desde la rama production.",
      "last_reviewed_at": "2026-03-23T00:55:00-06:00"
    }
  },
  "preferred_explanation_style": {
    "depth": "high",
    "compare_similar_services": true,
    "focus_on_exam_traps": true,
    "use_architecture_reasoning": true
  },
  "session_metrics": {
    "total_answered": 12,
    "total_correct": 6,
    "total_partial": 1,
    "total_wrong": 5,
    "average_confidence": 2.7,
    "average_response_time_seconds": null
  },
  "last_session_summary": "Pregunta 72 respondida correctamente. Buen entendimiento del patron canary en EC2 modelado con deployment groups separados dentro de un solo pipeline."
}
